{
  "builtin_expr_styles": {
    "aliases": {
      "c++": "cpp",
      "cc": "cpp",
      "cxx": "cpp",
      "golang": "go",
      "javascript": "js",
      "node": "js",
      "nodejs": "js",
      "py": "python",
      "python3": "python",
      "rs": "rust",
      "rustlang": "rust",
      "typescript": "ts"
    },
    "styles": {
      "c": {
        "base_lang": "c",
        "templates": {
          "BinaryOp": "{{ node.expr1 | expr_render }} {{ node.op }} {{ node.expr2 | expr_render }}",
          "BinaryOp(**)": "pow({{ node.expr1 | expr_render }}, {{ node.expr2 | expr_render }})",
          "BinaryOp(=>)": "((!({{ node.expr1 | expr_render }})) || ({{ node.expr2 | expr_render }}))",
          "BinaryOp(iff)": "(({{ node.expr1 | expr_render }}) == ({{ node.expr2 | expr_render }}))",
          "BinaryOp(xor)": "(({{ node.expr1 | expr_render }}) != ({{ node.expr2 | expr_render }}))",
          "Boolean": "{{ (1 if node.value else 0) | hex }}",
          "ConditionalOp": "({{ node.cond | expr_render }}) ? {{ node.value_true | expr_render }} : {{ node.value_false | expr_render }}",
          "Constant": "{{ node.value | repr }}",
          "Float": "{{ node.value | repr }}",
          "HexInt": "{{ node.value | hex }}",
          "Integer": "{{ node.value | repr }}",
          "Name": "{{ node.name }}",
          "Paren": "({{ node.expr | expr_render }})",
          "UFunc": "{{ node.func }}({{ node.expr | expr_render }})",
          "UnaryOp": "{{ node.op }}{{ node.expr | expr_render }}"
        }
      },
      "cpp": {
        "base_lang": "cpp",
        "templates": {
          "BinaryOp": "{{ node.expr1 | expr_render }} {{ node.op }} {{ node.expr2 | expr_render }}",
          "BinaryOp(**)": "std::pow({{ node.expr1 | expr_render }}, {{ node.expr2 | expr_render }})",
          "BinaryOp(=>)": "((!({{ node.expr1 | expr_render }})) || ({{ node.expr2 | expr_render }}))",
          "BinaryOp(iff)": "(({{ node.expr1 | expr_render }}) == ({{ node.expr2 | expr_render }}))",
          "BinaryOp(xor)": "(({{ node.expr1 | expr_render }}) != ({{ node.expr2 | expr_render }}))",
          "Boolean": "{{ \"true\" if node.value else \"false\" }}",
          "ConditionalOp": "({{ node.cond | expr_render }}) ? {{ node.value_true | expr_render }} : {{ node.value_false | expr_render }}",
          "Constant": "{{ node.value | repr }}",
          "Float": "{{ node.value | repr }}",
          "HexInt": "{{ node.value | hex }}",
          "Integer": "{{ node.value | repr }}",
          "Name": "{{ node.name }}",
          "Paren": "({{ node.expr | expr_render }})",
          "UFunc": "std::{{ node.func }}({{ node.expr | expr_render }})",
          "UnaryOp": "{{ node.op }}{{ node.expr | expr_render }}"
        }
      },
      "dsl": {
        "base_lang": "dsl",
        "templates": {
          "BinaryOp": "{{ node.expr1 | expr_render }} {{ node.op }} {{ node.expr2 | expr_render }}",
          "BinaryOp(=>)": "{{ node.expr1 | expr_render }} => {{ node.expr2 | expr_render }}",
          "BinaryOp(iff)": "{{ node.expr1 | expr_render }} iff {{ node.expr2 | expr_render }}",
          "BinaryOp(xor)": "{{ node.expr1 | expr_render }} xor {{ node.expr2 | expr_render }}",
          "Boolean": "{{ node.value | repr }}",
          "ConditionalOp": "({{ node.cond | expr_render }}) ? {{ node.value_true | expr_render }} : {{ node.value_false | expr_render }}",
          "Constant": "{{ node.value | repr }}",
          "Float": "{{ node.value | repr }}",
          "HexInt": "{{ node.value | hex }}",
          "Integer": "{{ node.value | repr }}",
          "Name": "{{ node.name }}",
          "Paren": "({{ node.expr | expr_render }})",
          "UFunc": "{{ node.func }}({{ node.expr | expr_render }})",
          "UnaryOp": "{{ node.op }}{{ node.expr | expr_render }}"
        }
      },
      "go": {
        "base_lang": "go",
        "templates": {
          "BinaryOp": "{{ node.expr1 | expr_render }} {{ node.op }} {{ node.expr2 | expr_render }}",
          "BinaryOp(**)": "math.Pow(float64({{ node.expr1 | expr_render }}), float64({{ node.expr2 | expr_render }}))",
          "BinaryOp(=>)": "((!({{ node.expr1 | expr_render }})) || ({{ node.expr2 | expr_render }}))",
          "BinaryOp(iff)": "(({{ node.expr1 | expr_render }}) == ({{ node.expr2 | expr_render }}))",
          "BinaryOp(xor)": "(({{ node.expr1 | expr_render }}) != ({{ node.expr2 | expr_render }}))",
          "Boolean": "{{ \"true\" if node.value else \"false\" }}",
          "ConditionalOp": "func() {{ go_expr_type(node) }} { if {{ node.cond | expr_render }} { return {{ node.value_true | expr_render }} }; return {{ node.value_false | expr_render }} }()",
          "Constant": "{{ \"math.Pi\" if node.value == \"pi\" else (\"math.E\" if node.value == \"e\" else (\"(2 * math.Pi)\" if node.value == \"tau\" else node.value | repr)) }}",
          "Float": "{{ node.value | repr }}",
          "HexInt": "{{ node.value | hex }}",
          "Integer": "{{ node.value | repr }}",
          "Name": "{{ node.name }}",
          "Paren": "({{ node.expr | expr_render }})",
          "UFunc": "math.{{ node.func | capitalize }}(float64({{ node.expr | expr_render }}))",
          "UFunc(abs)": "{{ go_abs_expr(node.expr | expr_render, node.expr) }}",
          "UFunc(ceil)": "int(math.Ceil(float64({{ node.expr | expr_render }})))",
          "UFunc(floor)": "int(math.Floor(float64({{ node.expr | expr_render }})))",
          "UFunc(round)": "int(math.Round(float64({{ node.expr | expr_render }})))",
          "UFunc(trunc)": "int(math.Trunc(float64({{ node.expr | expr_render }})))",
          "UnaryOp": "{{ node.op }}{{ node.expr | expr_render }}"
        }
      },
      "java": {
        "base_lang": "java",
        "templates": {
          "BinaryOp": "{{ node.expr1 | expr_render }} {{ node.op }} {{ node.expr2 | expr_render }}",
          "BinaryOp(**)": "Math.pow({{ node.expr1 | expr_render }}, {{ node.expr2 | expr_render }})",
          "BinaryOp(=>)": "((!({{ node.expr1 | expr_render }})) || ({{ node.expr2 | expr_render }}))",
          "BinaryOp(iff)": "(({{ node.expr1 | expr_render }}) == ({{ node.expr2 | expr_render }}))",
          "BinaryOp(xor)": "(({{ node.expr1 | expr_render }}) != ({{ node.expr2 | expr_render }}))",
          "Boolean": "{{ \"true\" if node.value else \"false\" }}",
          "ConditionalOp": "{{ node.cond | expr_render }} ? {{ node.value_true | expr_render }} : {{ node.value_false | expr_render }}",
          "Constant": "{{ \"Math.PI\" if node.value == \"pi\" else (\"Math.E\" if node.value == \"e\" else (\"(2.0 * Math.PI)\" if node.value == \"tau\" else node.value | repr)) }}",
          "Float": "{{ node.value | repr }}",
          "HexInt": "{{ node.value | hex }}",
          "Integer": "{{ node.value | repr }}",
          "Name": "{{ node.name }}",
          "Paren": "({{ node.expr | expr_render }})",
          "UFunc": "Math.{{ node.func }}({{ node.expr | expr_render }})",
          "UFunc(trunc)": "({{ node.expr | expr_render }}) >= 0 ? Math.floor({{ node.expr | expr_render }}) : Math.ceil({{ node.expr | expr_render }})",
          "UnaryOp": "{{ node.op }}{{ node.expr | expr_render }}"
        }
      },
      "js": {
        "base_lang": "js",
        "templates": {
          "BinaryOp": "{{ node.expr1 | expr_render }} {{ node.op }} {{ node.expr2 | expr_render }}",
          "BinaryOp(**)": "Math.pow({{ node.expr1 | expr_render }}, {{ node.expr2 | expr_render }})",
          "BinaryOp(=>)": "((!({{ node.expr1 | expr_render }})) || ({{ node.expr2 | expr_render }}))",
          "BinaryOp(iff)": "(({{ node.expr1 | expr_render }}) == ({{ node.expr2 | expr_render }}))",
          "BinaryOp(xor)": "(({{ node.expr1 | expr_render }}) != ({{ node.expr2 | expr_render }}))",
          "Boolean": "{{ \"true\" if node.value else \"false\" }}",
          "ConditionalOp": "({{ node.cond | expr_render }}) ? {{ node.value_true | expr_render }} : {{ node.value_false | expr_render }}",
          "Constant": "{{ \"Math.PI\" if node.value == \"pi\" else (\"Math.E\" if node.value == \"e\" else (\"(2 * Math.PI)\" if node.value == \"tau\" else node.value | repr)) }}",
          "Float": "{{ node.value | repr }}",
          "HexInt": "{{ node.value | hex }}",
          "Integer": "{{ node.value | repr }}",
          "Name": "{{ node.name }}",
          "Paren": "({{ node.expr | expr_render }})",
          "UFunc": "Math.{{ node.func }}({{ node.expr | expr_render }})",
          "UnaryOp": "{{ node.op }}{{ node.expr | expr_render }}"
        }
      },
      "python": {
        "base_lang": "python",
        "templates": {
          "BinaryOp": "{{ node.expr1 | expr_render }} {{ node.op }} {{ node.expr2 | expr_render }}",
          "BinaryOp(!=)": "{{ py_condition_operand(node.expr1 | expr_render, node.expr1) }} != {{ py_condition_operand(node.expr2 | expr_render, node.expr2) }}",
          "BinaryOp(&&)": "{{ node.expr1 | expr_render }} and {{ node.expr2 | expr_render }}",
          "BinaryOp(==)": "{{ py_condition_operand(node.expr1 | expr_render, node.expr1) }} == {{ py_condition_operand(node.expr2 | expr_render, node.expr2) }}",
          "BinaryOp(=>)": "((not ({{ node.expr1 | expr_render }})) or ({{ node.expr2 | expr_render }}))",
          "BinaryOp(iff)": "(({{ node.expr1 | expr_render }}) == ({{ node.expr2 | expr_render }}))",
          "BinaryOp(xor)": "(({{ node.expr1 | expr_render }}) != ({{ node.expr2 | expr_render }}))",
          "BinaryOp(||)": "{{ node.expr1 | expr_render }} or {{ node.expr2 | expr_render }}",
          "Boolean": "{{ node.value | repr }}",
          "ConditionalOp": "{{ node.value_true | expr_render }} if {{ node.cond | expr_render }} else {{ node.value_false | expr_render }}",
          "Constant": "{{ node.value | repr }}",
          "Float": "{{ node.value | repr }}",
          "HexInt": "{{ node.value | hex }}",
          "Integer": "{{ node.value | repr }}",
          "Name": "{{ node.name }}",